22:32:43.777530 IP (tos 0x0, ttl 4, id 0, offset 0, flags [DF], proto UDP (17), length 64)
    192.168.0.19.10101 > 239.255.255.251.10101: UDP, length 36
22:32:43.801262 IP (tos 0x0, ttl 236, id 16795, offset 0, flags [DF], proto TCP (6), length 52)
    34.234.154.181.443 > 192.168.0.6.56492: Flags [.], cksum 0x27e0 (correct), ack 1377086884, win 2171, options [nop,nop,TS val 2200700987 ecr 2994817882], length 0
22:32:43.811670 IP (tos 0x0, ttl 236, id 16796, offset 0, flags [DF], proto TCP (6), length 416)
    34.234.154.181.443 > 192.168.0.6.56492: Flags [P.], cksum 0xf20f (correct), seq 0:364, ack 1, win 2171, options [nop,nop,TS val 2200700988 ecr 2994817882], length 364
22:32:43.813079 IP (tos 0x0, ttl 64, id 28213, offset 0, flags [DF], proto TCP (6), length 125)
    192.168.0.6.56492 > 34.234.154.181.443: Flags [P.], cksum 0x9327 (correct), seq 1:74, ack 364, win 5139, options [nop,nop,TS val 2994817942 ecr 2200700988], length 73
22:32:43.813096 IP (tos 0x0, ttl 64, id 28214, offset 0, flags [DF], proto TCP (6), length 1500)
    192.168.0.6.56492 > 34.234.154.181.443: Flags [.], cksum 0x3367 (correct), seq 74:1522, ack 364, win 5139, options [nop,nop,TS val 2994817942 ecr 2200700988], length 1448
22:32:43.813097 IP (tos 0x0, ttl 64, id 28215, offset 0, flags [DF], proto TCP (6), length 366)
    192.168.0.6.56492 > 34.234.154.181.443: Flags [P.], cksum 0x3194 (correct), seq 1522:1836, ack 364, win 5139, options [nop,nop,TS val 2994817942 ecr 2200700988], length 314
22:32:43.851536 IP6 (hlim 1, next-header Options (0) payload length: 76) fe80::7989:7205:3902:ff12 > ff02::16: HBH (rtalert: 0x0000) (padn) [icmp6 sum ok] ICMP6, multicast listener report v2, 3 group record(s) [gaddr ff02::fb to_ex, 0 source(s)] [gaddr ff02::1:ff43:95ce to_ex, 0 source(s)] [gaddr ff02::1:ff02:ff12 to_ex, 0 source(s)]
22:32:43.857878 IP (tos 0x0, ttl 236, id 16797, offset 0, flags [DF], proto TCP (6), length 52)
    34.234.154.181.443 > 192.168.0.6.56492: Flags [.], cksum 0x2038 (correct), ack 1522, win 2171, options [nop,nop,TS val 2200701002 ecr 2994817942], length 0
22:32:43.899452 IP (tos 0x0, ttl 236, id 16798, offset 0, flags [DF], proto TCP (6), length 52)
    34.234.154.181.443 > 192.168.0.6.56492: Flags [.], cksum 0x1ef3 (correct), ack 1836, win 2171, options [nop,nop,TS val 2200701013 ecr 2994817942], length 0
22:32:43.931468 IP (tos 0x0, ttl 236, id 16799, offset 0, flags [DF], proto TCP (6), length 435)
    34.234.154.181.443 > 192.168.0.6.56492: Flags [P.], cksum 0xf20c (correct), seq 364:747, ack 1836, win 2171, options [nop,nop,TS val 2200701020 ecr 2994817942], length 383
22:32:43.931468 IP (tos 0x0, ttl 236, id 16800, offset 0, flags [DF], proto TCP (6), length 90)
    34.234.154.181.443 > 192.168.0.6.56492: Flags [P.], cksum 0x5f81 (correct), seq 747:785, ack 1836, win 2171, options [nop,nop,TS val 2200701020 ecr 2994817942], length 38
22:32:43.931540 IP (tos 0x0, ttl 64, id 28216, offset 0, flags [DF], proto TCP (6), length 52)
    192.168.0.6.56492 > 34.234.154.181.443: Flags [.], cksum 0x1122 (correct), ack 785, win 5162, options [nop,nop,TS val 2994818060 ecr 2200701020], length 0
22:32:44.410587 IP6 (hlim 1, next-header Options (0) payload length: 76) fe80::468a:5bff:fe83:8dc6 > ff02::16: HBH (rtalert: 0x0000) (padn) [icmp6 sum ok] ICMP6, multicast listener report v2, 3 group record(s) [gaddr ff02::1:3 to_ex, 0 source(s)] [gaddr ff02::1:ff4e:1466 to_ex, 0 source(s)] [gaddr ff02::1:ff83:8dc6 to_ex, 0 source(s)]
22:32:44.675007 IP6 (flowlabel 0xfdd83, hlim 255, next-header ICMPv6 (58) payload length: 32) fe80::7989:7205:3902:ff12 > ff02::1: [icmp6 sum ok] ICMP6, neighbor advertisement, length 32, tgt is ::e760:b0c5:243:95ce, Flags [override]
	  destination link-address option (2), length 8 (1): b8:27:eb:8e:13:1f
22:32:45.676187 IP6 (flowlabel 0xfdd83, hlim 255, next-header ICMPv6 (58) payload length: 32) fe80::7989:7205:3902:ff12 > ff02::1: [icmp6 sum ok] ICMP6, neighbor advertisement, length 32, tgt is ::e760:b0c5:243:95ce, Flags [override]
	  destination link-address option (2), length 8 (1): b8:27:eb:8e:13:1f
22:32:45.828346 IP (tos 0x0, ttl 64, id 48997, offset 0, flags [DF], proto TCP (6), length 162)
    192.168.0.6.45590 > 192.168.0.19.8009: Flags [P.], cksum 0x91b7 (correct), seq 3030266172:3030266282, ack 1499043224, win 501, options [nop,nop,TS val 2168761999 ecr 7188196], length 110
22:32:45.830807 IP (tos 0x0, ttl 64, id 25414, offset 0, flags [DF], proto TCP (6), length 162)
    192.168.0.19.8009 > 192.168.0.6.45590: Flags [P.], cksum 0x64a9 (correct), seq 1:111, ack 110, win 461, options [nop,nop,TS val 7188697 ecr 2168761999], length 110
22:32:45.830817 IP (tos 0x0, ttl 64, id 48998, offset 0, flags [DF], proto TCP (6), length 52)
    192.168.0.6.45590 > 192.168.0.19.8009: Flags [.], cksum 0x6b38 (correct), ack 111, win 501, options [nop,nop,TS val 2168762002 ecr 7188697], length 0
22:32:45.992437 IP (tos 0x0, ttl 64, id 29036, offset 0, flags [DF], proto TCP (6), length 169)
    192.168.0.6.47574 > 192.168.0.7.8009: Flags [P.], cksum 0x8314 (correct), seq 2474986088:2474986205, ack 2491744812, win 501, options [nop,nop,TS val 1330142615 ecr 6873495], length 117
22:32:45.994896 IP (tos 0x0, ttl 64, id 9166, offset 0, flags [DF], proto TCP (6), length 169)
    192.168.0.7.8009 > 192.168.0.6.47574: Flags [P.], cksum 0x04a2 (correct), seq 1:118, ack 117, win 461, options [nop,nop,TS val 6873995 ecr 1330142615], length 117
22:32:45.994928 IP (tos 0x0, ttl 64, id 29037, offset 0, flags [DF], proto TCP (6), length 52)
    192.168.0.6.47574 > 192.168.0.7.8009: Flags [.], cksum 0x13eb (correct), ack 118, win 501, options [nop,nop,TS val 1330142618 ecr 6873995], length 0
22:32:46.286155 ARP, Ethernet (len 6), IPv4 (len 4), Request who-has 192.168.0.4 tell 192.168.0.4, length 46
22:32:46.307249 IP (tos 0x0, ttl 239, id 17020, offset 0, flags [none], proto TCP (6), length 76)
    52.85.79.69.443 > 192.168.0.6.52856: Flags [P.], cksum 0xfab4 (correct), seq 2259351083:2259351107, ack 1011675039, win 266, options [nop,nop,TS val 3677343841 ecr 2991680478], length 24
22:32:46.307284 IP (tos 0x0, ttl 64, id 60809, offset 0, flags [DF], proto TCP (6), length 52)
    192.168.0.6.52856 > 52.85.79.69.443: Flags [.], cksum 0x3deb (correct), ack 24, win 501, options [nop,nop,TS val 2991725474 ecr 3677343841], length 0
22:32:46.600929 IP (tos 0x0, ttl 64, id 9263, offset 0, flags [DF], proto TCP (6), length 227)
    192.168.0.6.56306 > 192.168.0.5.8009: Flags [P.], cksum 0xfb3f (correct), seq 4105813104:4105813279, ack 1294067148, win 501, options [nop,nop,TS val 505728088 ecr 44890816], length 175
22:32:46.602683 IP (tos 0x0, ttl 64, id 27624, offset 0, flags [DF], proto TCP (6), length 258)
    192.168.0.5.8009 > 192.168.0.6.56306: Flags [P.], cksum 0xc361 (correct), seq 1:207, ack 175, win 1609, options [nop,nop,TS val 44891804 ecr 505728088], length 206
22:32:46.602708 IP (tos 0x0, ttl 64, id 9264, offset 0, flags [DF], proto TCP (6), length 52)
    192.168.0.6.56306 > 192.168.0.5.8009: Flags [.], cksum 0x26bc (correct), ack 207, win 524, options [nop,nop,TS val 505728090 ecr 44891804], length 0
22:32:46.611273 IP (tos 0x0, ttl 64, id 29038, offset 0, flags [DF], proto TCP (6), length 234)
    192.168.0.6.47574 > 192.168.0.7.8009: Flags [P.], cksum 0x23c3 (correct), seq 117:299, ack 118, win 501, options [nop,nop,TS val 1330143234 ecr 6873995], length 182
22:32:46.621230 IP (tos 0x0, ttl 64, id 48999, offset 0, flags [DF], proto TCP (6), length 227)
    192.168.0.6.45590 > 192.168.0.19.8009: Flags [P.], cksum 0x5279 (correct), seq 110:285, ack 111, win 501, options [nop,nop,TS val 2168762792 ecr 7188697], length 175
22:32:46.623636 IP (tos 0x0, ttl 64, id 25415, offset 0, flags [DF], proto TCP (6), length 260)
    192.168.0.19.8009 > 192.168.0.6.45590: Flags [P.], cksum 0x8a3a (correct), seq 111:319, ack 285, win 478, options [nop,nop,TS val 7188776 ecr 2168762792], length 208
22:32:46.623663 IP (tos 0x0, ttl 64, id 49000, offset 0, flags [DF], proto TCP (6), length 52)
    192.168.0.6.45590 > 192.168.0.19.8009: Flags [.], cksum 0x663b (correct), ack 319, win 524, options [nop,nop,TS val 2168762794 ecr 7188776], length 0
22:32:46.627232 IP (tos 0x0, ttl 64, id 49001, offset 0, flags [DF], proto TCP (6), length 227)
    192.168.0.6.45590 > 192.168.0.19.8009: Flags [P.], cksum 0xe564 (correct), seq 285:460, ack 319, win 524, options [nop,nop,TS val 2168762798 ecr 7188776], length 175
22:32:46.627324 IP (tos 0x0, ttl 64, id 36622, offset 0, flags [DF], proto TCP (6), length 227)
    192.168.0.6.41544 > 192.168.0.17.8009: Flags [P.], cksum 0xefff (correct), seq 1604727743:1604727918, ack 1845931036, win 501, options [nop,nop,TS val 2536899828 ecr 6420743], length 175
22:32:46.627434 IP (tos 0x0, ttl 64, id 9167, offset 0, flags [DF], proto TCP (6), length 265)
    192.168.0.7.8009 > 192.168.0.6.47574: Flags [P.], cksum 0xc372 (correct), seq 118:331, ack 299, win 478, options [nop,nop,TS val 6874059 ecr 1330143234], length 213
22:32:46.627448 IP (tos 0x0, ttl 64, id 29039, offset 0, flags [DF], proto TCP (6), length 52)
    192.168.0.6.47574 > 192.168.0.7.8009: Flags [.], cksum 0x0f91 (correct), ack 331, win 524, options [nop,nop,TS val 1330143250 ecr 6874059], length 0
22:32:46.627471 IP (tos 0x0, ttl 64, id 36623, offset 0, flags [DF], proto TCP (6), length 227)
    192.168.0.6.41544 > 192.168.0.17.8009: Flags [P.], cksum 0x75c9 (correct), seq 175:350, ack 1, win 501, options [nop,nop,TS val 2536899828 ecr 6420743], length 175
22:32:46.631994 IP (tos 0x0, ttl 64, id 65246, offset 0, flags [DF], proto TCP (6), length 52)
    192.168.0.17.8009 > 192.168.0.6.41544: Flags [.], cksum 0xeb91 (correct), ack 350, win 495, options [nop,nop,TS val 6421200 ecr 2536899828], length 0
22:32:46.634745 IP (tos 0x0, ttl 64, id 25416, offset 0, flags [DF], proto TCP (6), length 258)
    192.168.0.19.8009 > 192.168.0.6.45590: Flags [P.], cksum 0xac08 (correct), seq 319:525, ack 460, win 495, options [nop,nop,TS val 7188776 ecr 2168762798], length 206
22:32:46.634764 IP (tos 0x0, ttl 64, id 49002, offset 0, flags [DF], proto TCP (6), length 52)
    192.168.0.6.45590 > 192.168.0.19.8009: Flags [.], cksum 0x649c (correct), ack 525, win 546, options [nop,nop,TS val 2168762806 ecr 7188776], length 0
22:32:46.635331 IP (tos 0x0, ttl 64, id 65247, offset 0, flags [DF], proto TCP (6), length 260)
    192.168.0.17.8009 > 192.168.0.6.41544: Flags [P.], cksum 0x55e2 (correct), seq 1:209, ack 350, win 495, options [nop,nop,TS val 6421200 ecr 2536899828], length 208
22:32:46.635331 IP (tos 0x0, ttl 64, id 65248, offset 0, flags [DF], proto TCP (6), length 258)
    192.168.0.17.8009 > 192.168.0.6.41544: Flags [P.], cksum 0x4747 (correct), seq 209:415, ack 350, win 495, options [nop,nop,TS val 6421200 ecr 2536899828], length 206
22:32:46.635341 IP (tos 0x0, ttl 64, id 36624, offset 0, flags [DF], proto TCP (6), length 52)
    192.168.0.6.41544 > 192.168.0.17.8009: Flags [.], cksum 0xea9c (correct), ack 209, win 524, options [nop,nop,TS val 2536899836 ecr 6421200], length 0
22:32:46.635348 IP (tos 0x0, ttl 64, id 36625, offset 0, flags [DF], proto TCP (6), length 52)
    192.168.0.6.41544 > 192.168.0.17.8009: Flags [.], cksum 0xe9b8 (correct), ack 415, win 546, options [nop,nop,TS val 2536899836 ecr 6421200], length 0
22:32:46.671437 IP6 (hlim 255, next-header ICMPv6 (58) payload length: 56) fe80::1286:8cff:fe17:2317 > ff02::1: [icmp6 sum ok] ICMP6, router advertisement, length 56
	hop limit 64, Flags [other stateful], pref medium, router lifetime 0s, reachable time 3600000ms, retrans timer 1000ms
	  prefix info option (3), length 32 (4): ::/64, Flags [onlink, auto], valid time 3600s, pref. time 3600s
	  source link-address option (1), length 8 (1): 10:86:8c:17:23:17
22:32:46.672923 IP6 (flowlabel 0xfdd83, hlim 255, next-header ICMPv6 (58) payload length: 32) fe80::7989:7205:3902:ff12 > ff02::1: [icmp6 sum ok] ICMP6, neighbor advertisement, length 32, tgt is ::e760:b0c5:243:95ce, Flags [override]
	  destination link-address option (2), length 8 (1): b8:27:eb:8e:13:1f
22:32:46.680568 IP6 (hlim 1, next-header Options (0) payload length: 76) fe80::468a:5bff:fe83:8dc6 > ff02::16: HBH (rtalert: 0x0000) (padn) [icmp6 sum ok] ICMP6, multicast listener report v2, 3 group record(s) [gaddr ff02::1:3 to_ex, 0 source(s)] [gaddr ff02::1:ff4e:1466 to_ex, 0 source(s)] [gaddr ff02::1:ff83:8dc6 to_ex, 0 source(s)]
22:32:46.701599 IP6 (hlim 1, next-header Options (0) payload length: 76) fe80::7989:7205:3902:ff12 > ff02::16: HBH (rtalert: 0x0000) (padn) [icmp6 sum ok] ICMP6, multicast listener report v2, 3 group record(s) [gaddr ff02::fb to_ex, 0 source(s)] [gaddr ff02::1:ff43:95ce to_ex, 0 source(s)] [gaddr ff02::1:ff02:ff12 to_ex, 0 source(s)]
22:32:46.997261 IP6 (hlim 1, next-header Options (0) payload length: 76) fe80::468a:5bff:fe83:8dc6 > ff02::16: HBH (rtalert: 0x0000) (padn) [icmp6 sum ok] ICMP6, multicast listener report v2, 3 group record(s) [gaddr ff02::1:3 to_ex, 0 source(s)] [gaddr ff02::1:ff4e:1466 to_ex, 0 source(s)] [gaddr ff02::1:ff83:8dc6 to_ex, 0 source(s)]
22:32:47.408244 IP (tos 0x0, ttl 64, id 11578, offset 0, flags [DF], proto TCP (6), length 695)
    192.168.0.6.35754 > 54.230.16.50.443: Flags [P.], cksum 0xaa7e (correct), seq 4038060552:4038061195, ack 580385697, win 501, options [nop,nop,TS val 2500133082 ecr 2310331367], length 643
22:32:47.441050 IP (tos 0x0, ttl 239, id 34483, offset 0, flags [none], proto TCP (6), length 52)
    54.230.16.50.443 > 192.168.0.6.35754: Flags [.], cksum 0x7d3d (correct), ack 643, win 293, options [nop,nop,TS val 2310359077 ecr 2500133082], length 0
22:32:47.581535 IP6 (hlim 1, next-header Options (0) payload length: 76) fe80::7989:7205:3902:ff12 > ff02::16: HBH (rtalert: 0x0000) (padn) [icmp6 sum ok] ICMP6, multicast listener report v2, 3 group record(s) [gaddr ff02::fb to_ex, 0 source(s)] [gaddr ff02::1:ff43:95ce to_ex, 0 source(s)] [gaddr ff02::1:ff02:ff12 to_ex, 0 source(s)]
22:32:47.601252 IP (tos 0x0, ttl 239, id 34491, offset 0, flags [none], proto TCP (6), length 901)
    54.230.16.50.443 > 192.168.0.6.35754: Flags [P.], cksum 0x3d4f (correct), seq 1:850, ack 643, win 293, options [nop,nop,TS val 2310359244 ecr 2500133082], length 849
22:32:47.601266 IP (tos 0x0, ttl 64, id 11579, offset 0, flags [DF], proto TCP (6), length 52)
    192.168.0.6.35754 > 54.230.16.50.443: Flags [.], cksum 0x77b4 (correct), ack 850, win 501, options [nop,nop,TS val 2500133275 ecr 2310359244], length 0
22:32:47.602897 IP (tos 0x0, ttl 64, id 11580, offset 0, flags [DF], proto TCP (6), length 664)
    192.168.0.6.35754 > 54.230.16.50.443: Flags [P.], cksum 0x5b94 (correct), seq 643:1255, ack 850, win 501, options [nop,nop,TS val 2500133277 ecr 2310359244], length 612
22:32:47.624381 IP (tos 0x0, ttl 239, id 34492, offset 0, flags [none], proto TCP (6), length 52)
    54.230.16.50.443 > 192.168.0.6.35754: Flags [.], cksum 0x75ff (correct), ack 1255, win 298, options [nop,nop,TS val 2310359270 ecr 2500133277], length 0
22:32:47.674976 IP6 (flowlabel 0xfdd83, hlim 255, next-header ICMPv6 (58) payload length: 32) fe80::7989:7205:3902:ff12 > ff02::1: [icmp6 sum ok] ICMP6, neighbor advertisement, length 32, tgt is ::e760:b0c5:243:95ce, Flags [override]
	  destination link-address option (2), length 8 (1): b8:27:eb:8e:13:1f
22:32:47.768818 IP (tos 0x0, ttl 239, id 34503, offset 0, flags [none], proto TCP (6), length 1557)
    54.230.16.50.443 > 192.168.0.6.35754: Flags [P.], cksum 0x0dce (incorrect -> 0x83f1), seq 850:2355, ack 1255, win 298, options [nop,nop,TS val 2310359414 ecr 2500133277], length 1505
22:32:47.768835 IP (tos 0x0, ttl 64, id 11581, offset 0, flags [DF], proto TCP (6), length 52)
    192.168.0.6.35754 > 54.230.16.50.443: Flags [.], cksum 0x6e23 (correct), ack 2355, win 495, options [nop,nop,TS val 2500133443 ecr 2310359414], length 0
22:32:47.776480 IP (tos 0x0, ttl 64, id 61334, offset 0, flags [DF], proto TCP (6), length 1142)
    192.168.0.6.45224 > 52.85.79.103.443: Flags [P.], cksum 0x261d (correct), seq 4183145395:4183146485, ack 3702207281, win 11855, options [nop,nop,TS val 2834046835 ecr 2849552076], length 1090
22:32:47.846331 IP (tos 0x0, ttl 239, id 64162, offset 0, flags [none], proto TCP (6), length 1490)
    52.85.79.103.443 > 192.168.0.6.45224: Flags [.], cksum 0x6167 (correct), seq 1:1439, ack 1090, win 2043, options [nop,nop,TS val 2849557885 ecr 2834046835], length 1438
22:32:47.846350 IP (tos 0x0, ttl 64, id 61335, offset 0, flags [DF], proto TCP (6), length 52)
    192.168.0.6.45224 > 52.85.79.103.443: Flags [.], cksum 0x42e6 (correct), ack 1439, win 11846, options [nop,nop,TS val 2834046905 ecr 2849557885], length 0
22:32:47.855781 IP (tos 0x0, ttl 239, id 64163, offset 0, flags [none], proto TCP (6), length 1490)
    52.85.79.103.443 > 192.168.0.6.45224: Flags [P.], cksum 0x0e5d (correct), seq 1439:2877, ack 1090, win 2043, options [nop,nop,TS val 2849557885 ecr 2834046835], length 1438
22:32:47.855785 IP (tos 0x0, ttl 64, id 61336, offset 0, flags [DF], proto TCP (6), length 52)
    192.168.0.6.45224 > 52.85.79.103.443: Flags [.], cksum 0x3d3e (correct), ack 2877, win 11846, options [nop,nop,TS val 2834046915 ecr 2849557885], length 0
22:32:47.856205 IP (tos 0x0, ttl 239, id 64164, offset 0, flags [none], proto TCP (6), length 1490)
    52.85.79.103.443 > 192.168.0.6.45224: Flags [.], cksum 0xc46b (correct), seq 2877:4315, ack 1090, win 2043, options [nop,nop,TS val 2849557885 ecr 2834046835], length 1438
22:32:47.856209 IP (tos 0x0, ttl 64, id 61337, offset 0, flags [DF], proto TCP (6), length 52)
    192.168.0.6.45224 > 52.85.79.103.443: Flags [.], cksum 0x37a0 (correct), ack 4315, win 11846, options [nop,nop,TS val 2834046915 ecr 2849557885], length 0
22:32:47.856588 IP (tos 0x0, ttl 239, id 64165, offset 0, flags [none], proto TCP (6), length 1490)
    52.85.79.103.443 > 192.168.0.6.45224: Flags [.], cksum 0x363b (correct), seq 4315:5753, ack 1090, win 2043, options [nop,nop,TS val 2849557885 ecr 2834046835], length 1438
22:32:47.856593 IP (tos 0x0, ttl 64, id 61338, offset 0, flags [DF], proto TCP (6), length 52)
    192.168.0.6.45224 > 52.85.79.103.443: Flags [.], cksum 0x3202 (correct), ack 5753, win 11846, options [nop,nop,TS val 2834046915 ecr 2849557885], length 0
22:32:47.856823 IP (tos 0x0, ttl 239, id 64166, offset 0, flags [none], proto TCP (6), length 247)
    52.85.79.103.443 > 192.168.0.6.45224: Flags [P.], cksum 0x62e8 (correct), seq 5753:5948, ack 1090, win 2043, options [nop,nop,TS val 2849557885 ecr 2834046835], length 195
22:32:47.856823 IP (tos 0x0, ttl 239, id 64167, offset 0, flags [none], proto TCP (6), length 79)
    52.85.79.103.443 > 192.168.0.6.45224: Flags [P.], cksum 0xceb7 (correct), seq 5948:5975, ack 1090, win 2043, options [nop,nop,TS val 2849557885 ecr 2834046835], length 27
22:32:47.856844 IP (tos 0x0, ttl 64, id 61339, offset 0, flags [DF], proto TCP (6), length 52)
    192.168.0.6.45224 > 52.85.79.103.443: Flags [.], cksum 0x313e (correct), ack 5948, win 11846, options [nop,nop,TS val 2834046916 ecr 2849557885], length 0
22:32:47.856865 IP (tos 0x0, ttl 64, id 61340, offset 0, flags [DF], proto TCP (6), length 52)
    192.168.0.6.45224 > 52.85.79.103.443: Flags [.], cksum 0x3123 (correct), ack 5975, win 11846, options [nop,nop,TS val 2834046916 ecr 2849557885], length 0
22:32:48.676192 IP6 (flowlabel 0xfdd83, hlim 255, next-header ICMPv6 (58) payload length: 32) fe80::7989:7205:3902:ff12 > ff02::1: [icmp6 sum ok] ICMP6, neighbor advertisement, length 32, tgt is ::e760:b0c5:243:95ce, Flags [override]
	  destination link-address option (2), length 8 (1): b8:27:eb:8e:13:1f
22:32:49.080909 IP (tos 0x0, ttl 64, id 24326, offset 0, flags [DF], proto UDP (17), length 94)
    192.168.0.6.39886 > 8.8.8.8.53: 31500+ [1au] A? asimov.vortex.data.trafficmanager.net. (66)
22:32:49.080958 IP (tos 0x0, ttl 64, id 24327, offset 0, flags [DF], proto UDP (17), length 94)
    192.168.0.6.54938 > 8.8.8.8.53: 7194+ [1au] AAAA? asimov.vortex.data.trafficmanager.net. (66)
22:32:49.123007 IP (tos 0x0, ttl 117, id 25925, offset 0, flags [none], proto UDP (17), length 176)
    8.8.8.8.53 > 192.168.0.6.54938: 7194 1/1/1 asimov.vortex.data.trafficmanager.net. CNAME global.vortex.data.trafficmanager.net. (148)
22:32:49.127330 IP (tos 0x0, ttl 115, id 13955, offset 0, flags [none], proto UDP (17), length 131)
    8.8.8.8.53 > 192.168.0.6.39886: 31500 2/0/1 asimov.vortex.data.trafficmanager.net. CNAME global.vortex.data.trafficmanager.net., global.vortex.data.trafficmanager.net. A 64.4.54.254 (103)
22:32:49.127485 IP (tos 0x0, ttl 64, id 24338, offset 0, flags [DF], proto UDP (17), length 94)
    192.168.0.6.33584 > 8.8.8.8.53: 17047+ [1au] AAAA? global.vortex.data.trafficmanager.net. (66)
22:32:49.201186 IP (tos 0x0, ttl 117, id 6325, offset 0, flags [none], proto UDP (17), length 155)
    8.8.8.8.53 > 192.168.0.6.33584: 17047 0/1/1 (127)
22:32:49.201616 IP (tos 0x0, ttl 64, id 36707, offset 0, flags [DF], proto TCP (6), length 60)
    192.168.0.6.56060 > 64.4.54.254.443: Flags [S], cksum 0x5da3 (correct), seq 3472218327, win 64240, options [mss 1460,sackOK,TS val 3664926915 ecr 0,nop,wscale 7], length 0
22:32:49.251079 IP (tos 0x0, ttl 110, id 25781, offset 0, flags [DF], proto TCP (6), length 60)
    64.4.54.254.443 > 192.168.0.6.56060: Flags [S.], cksum 0x68e6 (correct), seq 611708398, ack 3472218328, win 8192, options [mss 1440,nop,wscale 8,sackOK,TS val 533044614 ecr 3664926915], length 0
22:32:49.251102 IP (tos 0x0, ttl 64, id 36708, offset 0, flags [DF], proto TCP (6), length 52)
    192.168.0.6.56060 > 64.4.54.254.443: Flags [.], cksum 0xb577 (correct), ack 1, win 502, options [nop,nop,TS val 3664926965 ecr 533044614], length 0
22:32:49.251285 IP (tos 0x0, ttl 64, id 36709, offset 0, flags [DF], proto TCP (6), length 569)
    192.168.0.6.56060 > 64.4.54.254.443: Flags [P.], cksum 0x5f44 (correct), seq 1:518, ack 1, win 502, options [nop,nop,TS val 3664926965 ecr 533044614], length 517
22:32:49.300920 IP (tos 0x0, ttl 110, id 25782, offset 0, flags [DF], proto TCP (6), length 1500)
    64.4.54.254.443 > 192.168.0.6.56060: Flags [.], cksum 0x2761 (correct), seq 1:1449, ack 518, win 1029, options [nop,nop,TS val 533044658 ecr 3664926965], length 1448
22:32:49.300938 IP (tos 0x0, ttl 64, id 36710, offset 0, flags [DF], proto TCP (6), length 52)
    192.168.0.6.56060 > 64.4.54.254.443: Flags [.], cksum 0xad6d (correct), ack 1449, win 501, options [nop,nop,TS val 3664927015 ecr 533044658], length 0
22:32:49.311172 IP (tos 0x0, ttl 110, id 25783, offset 0, flags [DF], proto TCP (6), length 1500)
    64.4.54.254.443 > 192.168.0.6.56060: Flags [.], cksum 0x3280 (correct), seq 1449:2897, ack 518, win 1029, options [nop,nop,TS val 533044658 ecr 3664926965], length 1448
22:32:49.311177 IP (tos 0x0, ttl 64, id 36711, offset 0, flags [DF], proto TCP (6), length 52)
    192.168.0.6.56060 > 64.4.54.254.443: Flags [.], cksum 0xa7bb (correct), ack 2897, win 501, options [nop,nop,TS val 3664927025 ecr 533044658], length 0
22:32:49.311538 IP (tos 0x0, ttl 110, id 25784, offset 0, flags [DF], proto TCP (6), length 922)
    64.4.54.254.443 > 192.168.0.6.56060: Flags [P.], cksum 0x7f27 (correct), seq 2897:3767, ack 518, win 1029, options [nop,nop,TS val 533044658 ecr 3664926965], length 870
22:32:49.311540 IP (tos 0x0, ttl 64, id 36712, offset 0, flags [DF], proto TCP (6), length 52)
    192.168.0.6.56060 > 64.4.54.254.443: Flags [.], cksum 0xa455 (correct), ack 3767, win 501, options [nop,nop,TS val 3664927025 ecr 533044658], length 0
22:32:49.312242 IP (tos 0x0, ttl 64, id 36713, offset 0, flags [DF], proto TCP (6), length 145)
    192.168.0.6.56060 > 64.4.54.254.443: Flags [P.], cksum 0x4b1e (correct), seq 518:611, ack 3767, win 501, options [nop,nop,TS val 3664927026 ecr 533044658], length 93
22:32:49.459091 IP6 (hlim 255, next-header ICMPv6 (58) payload length: 32) fe80::1286:8cff:fe17:2317 > ff02::1:ff6f:a2: [icmp6 sum ok] ICMP6, neighbor solicitation, length 32, who has ::7a80:38ff:fe6f:a2
	  source link-address option (1), length 8 (1): 10:86:8c:17:23:17
22:32:49.559354 IP (tos 0x0, ttl 255, id 49069, offset 0, flags [none], proto UDP (17), length 73)
    192.168.0.16.5353 > 224.0.0.251.5353: 0 PTR (QM)? _spotify-connect._tcp.local. (45)
22:32:49.583918 IP (tos 0x0, ttl 64, id 36714, offset 0, flags [DF], proto TCP (6), length 145)
    192.168.0.6.56060 > 64.4.54.254.443: Flags [P.], cksum 0x4a0e (correct), seq 518:611, ack 3767, win 501, options [nop,nop,TS val 3664927298 ecr 533044658], length 93
22:32:49.621281 IP (tos 0x0, ttl 110, id 25786, offset 0, flags [DF], proto TCP (6), length 64)
    64.4.54.254.443 > 192.168.0.6.56060: Flags [.], cksum 0x1649 (correct), ack 611, win 1029, options [nop,nop,TS val 533044994 ecr 3664927026,nop,nop,sack 1 {518:611}], length 0
22:32:49.629439 IP (tos 0x0, ttl 110, id 25787, offset 0, flags [DF], proto TCP (6), length 103)
    64.4.54.254.443 > 192.168.0.6.56060: Flags [P.], cksum 0x05b5 (correct), seq 3767:3818, ack 611, win 1029, options [nop,nop,TS val 533045002 ecr 3664927026], length 51
22:32:49.629452 IP (tos 0x0, ttl 64, id 36715, offset 0, flags [DF], proto TCP (6), length 52)
    192.168.0.6.56060 > 64.4.54.254.443: Flags [.], cksum 0xa12f (correct), ack 3818, win 501, options [nop,nop,TS val 3664927343 ecr 533045002], length 0
22:32:49.630037 IP (tos 0x0, ttl 64, id 36716, offset 0, flags [DF], proto TCP (6), length 1387)
    192.168.0.6.56060 > 64.4.54.254.443: Flags [P.], cksum 0x2de0 (correct), seq 611:1946, ack 3818, win 501, options [nop,nop,TS val 3664927344 ecr 533045002], length 1335
22:32:49.677905 IP6 (hlim 255, next-header ICMPv6 (58) payload length: 56) fe80::1286:8cff:fe17:2317 > ff02::1: [icmp6 sum ok] ICMP6, router advertisement, length 56
	hop limit 64, Flags [other stateful], pref medium, router lifetime 0s, reachable time 3600000ms, retrans timer 1000ms
	  prefix info option (3), length 32 (4): ::/64, Flags [onlink, auto], valid time 3600s, pref. time 3600s
	  source link-address option (1), length 8 (1): 10:86:8c:17:23:17
22:32:49.679392 IP6 (flowlabel 0xfdd83, hlim 255, next-header ICMPv6 (58) payload length: 32) fe80::7989:7205:3902:ff12 > ff02::1: [icmp6 sum ok] ICMP6, neighbor advertisement, length 32, tgt is ::e760:b0c5:243:95ce, Flags [override]
	  destination link-address option (2), length 8 (1): b8:27:eb:8e:13:1f
22:32:49.687252 IP6 (hlim 1, next-header Options (0) payload length: 76) fe80::468a:5bff:fe83:8dc6 > ff02::16: HBH (rtalert: 0x0000) (padn) [icmp6 sum ok] ICMP6, multicast listener report v2, 3 group record(s) [gaddr ff02::1:3 to_ex, 0 source(s)] [gaddr ff02::1:ff4e:1466 to_ex, 0 source(s)] [gaddr ff02::1:ff83:8dc6 to_ex, 0 source(s)]
22:32:49.701608 IP6 (hlim 1, next-header Options (0) payload length: 76) fe80::7989:7205:3902:ff12 > ff02::16: HBH (rtalert: 0x0000) (padn) [icmp6 sum ok] ICMP6, multicast listener report v2, 3 group record(s) [gaddr ff02::fb to_ex, 0 source(s)] [gaddr ff02::1:ff43:95ce to_ex, 0 source(s)] [gaddr ff02::1:ff02:ff12 to_ex, 0 source(s)]
22:32:49.711266 IP (tos 0x0, ttl 110, id 25788, offset 0, flags [DF], proto TCP (6), length 366)
    64.4.54.254.443 > 192.168.0.6.56060: Flags [FP.], cksum 0xf8ba (correct), seq 3818:4132, ack 1946, win 1023, options [nop,nop,TS val 533045064 ecr 3664927344], length 314
22:32:49.711590 IP (tos 0x0, ttl 64, id 36717, offset 0, flags [DF], proto TCP (6), length 83)
    192.168.0.6.56060 > 64.4.54.254.443: Flags [P.], cksum 0x9ea1 (correct), seq 1946:1977, ack 4133, win 501, options [nop,nop,TS val 3664927425 ecr 533045064], length 31
22:32:49.711607 IP (tos 0x0, ttl 64, id 36718, offset 0, flags [DF], proto TCP (6), length 52)
    192.168.0.6.56060 > 64.4.54.254.443: Flags [F.], cksum 0x9a0d (correct), seq 1977, ack 4133, win 501, options [nop,nop,TS val 3664927425 ecr 533045064], length 0
22:32:49.756973 IP (tos 0x0, ttl 110, id 25789, offset 0, flags [DF], proto TCP (6), length 52)
    64.4.54.254.443 > 192.168.0.6.56060: Flags [.], cksum 0x97bc (correct), ack 1978, win 1029, options [nop,nop,TS val 533045129 ecr 3664927425], length 0
22:32:49.766003 IP (tos 0x0, ttl 64, id 11582, offset 0, flags [DF], proto TCP (6), length 719)
    192.168.0.6.35754 > 54.230.16.50.443: Flags [P.], cksum 0x02d8 (correct), seq 1255:1922, ack 2355, win 501, options [nop,nop,TS val 2500135440 ecr 2310359414], length 667
22:32:49.770639 IP (tos 0x0, ttl 64, id 24400, offset 0, flags [DF], proto UDP (17), length 86)
    192.168.0.6.51512 > 8.8.8.8.53: 45397+ [1au] A? d3ad8414wy4gwn.cloudfront.net. (58)
22:32:49.804831 IP (tos 0x0, ttl 239, id 34725, offset 0, flags [none], proto TCP (6), length 52)
    54.230.16.50.443 > 192.168.0.6.35754: Flags [.], cksum 0x5c92 (correct), ack 1922, win 304, options [nop,nop,TS val 2310361438 ecr 2500135440], length 0
22:32:49.832713 IP (tos 0x0, ttl 117, id 15080, offset 0, flags [none], proto UDP (17), length 150)
    8.8.8.8.53 > 192.168.0.6.51512: 45397 4/0/1 d3ad8414wy4gwn.cloudfront.net. A 13.225.43.44, d3ad8414wy4gwn.cloudfront.net. A 13.225.43.55, d3ad8414wy4gwn.cloudfront.net. A 13.225.43.38, d3ad8414wy4gwn.cloudfront.net. A 13.225.43.63 (122)
22:32:49.833236 IP (tos 0x0, ttl 64, id 24940, offset 0, flags [DF], proto TCP (6), length 60)
    192.168.0.6.36502 > 13.225.43.44.443: Flags [S], cksum 0x114b (correct), seq 608100502, win 64240, options [mss 1460,sackOK,TS val 2747795738 ecr 0,nop,wscale 7], length 0
22:32:49.833268 IP (tos 0x0, ttl 64, id 60749, offset 0, flags [DF], proto TCP (6), length 60)
    192.168.0.6.36504 > 13.225.43.44.443: Flags [S], cksum 0x789c (correct), seq 1452492526, win 64240, options [mss 1460,sackOK,TS val 2747795738 ecr 0,nop,wscale 7], length 0
22:32:49.833283 IP (tos 0x0, ttl 64, id 1975, offset 0, flags [DF], proto TCP (6), length 60)
    192.168.0.6.36506 > 13.225.43.44.443: Flags [S], cksum 0x15a2 (correct), seq 1494001517, win 64240, options [mss 1460,sackOK,TS val 2747795738 ecr 0,nop,wscale 7], length 0
22:32:49.833298 IP (tos 0x0, ttl 64, id 53460, offset 0, flags [DF], proto TCP (6), length 60)
    192.168.0.6.36508 > 13.225.43.44.443: Flags [S], cksum 0x0b3b (correct), seq 2311160093, win 64240, options [mss 1460,sackOK,TS val 2747795738 ecr 0,nop,wscale 7], length 0
22:32:49.871918 IP (tos 0x0, ttl 240, id 55880, offset 0, flags [none], proto TCP (6), length 60)
    13.225.43.44.443 > 192.168.0.6.36502: Flags [S.], cksum 0x8a08 (correct), seq 3381603824, ack 608100503, win 65535, options [mss 1450,sackOK,TS val 1176061074 ecr 2747795738,nop,wscale 8], length 0
22:32:49.871942 IP (tos 0x0, ttl 64, id 24941, offset 0, flags [DF], proto TCP (6), length 52)
    192.168.0.6.36502 > 13.225.43.44.443: Flags [.], cksum 0xb6ae (correct), ack 1, win 502, options [nop,nop,TS val 2747795777 ecr 1176061074], length 0
22:32:49.872097 IP (tos 0x0, ttl 64, id 24942, offset 0, flags [DF], proto TCP (6), length 569)
    192.168.0.6.36502 > 13.225.43.44.443: Flags [P.], cksum 0xe1b2 (correct), seq 1:518, ack 1, win 502, options [nop,nop,TS val 2747795777 ecr 1176061074], length 517
22:32:49.873213 IP (tos 0x0, ttl 240, id 42237, offset 0, flags [none], proto TCP (6), length 60)
    13.225.43.44.443 > 192.168.0.6.36506: Flags [S.], cksum 0x2ab4 (correct), seq 3188185988, ack 1494001518, win 65535, options [mss 1450,sackOK,TS val 1370552985 ecr 2747795738,nop,wscale 8], length 0
22:32:49.873224 IP (tos 0x0, ttl 64, id 1976, offset 0, flags [DF], proto TCP (6), length 52)
    192.168.0.6.36506 > 13.225.43.44.443: Flags [.], cksum 0x5759 (correct), ack 1, win 502, options [nop,nop,TS val 2747795778 ecr 1370552985], length 0
22:32:49.873338 IP (tos 0x0, ttl 64, id 1977, offset 0, flags [DF], proto TCP (6), length 569)
    192.168.0.6.36506 > 13.225.43.44.443: Flags [P.], cksum 0x47ac (correct), seq 1:518, ack 1, win 502, options [nop,nop,TS val 2747795778 ecr 1370552985], length 517
22:32:49.874612 IP (tos 0x0, ttl 240, id 20288, offset 0, flags [none], proto TCP (6), length 60)
    13.225.43.44.443 > 192.168.0.6.36508: Flags [S.], cksum 0x4a38 (correct), seq 2268739524, ack 2311160094, win 65535, options [mss 1450,sackOK,TS val 1710266108 ecr 2747795738,nop,wscale 8], length 0
22:32:49.874623 IP (tos 0x0, ttl 64, id 53461, offset 0, flags [DF], proto TCP (6), length 52)
    192.168.0.6.36508 > 13.225.43.44.443: Flags [.], cksum 0x76dc (correct), ack 1, win 502, options [nop,nop,TS val 2747795779 ecr 1710266108], length 0
22:32:49.874748 IP (tos 0x0, ttl 64, id 53462, offset 0, flags [DF], proto TCP (6), length 569)
    192.168.0.6.36508 > 13.225.43.44.443: Flags [P.], cksum 0x9aa7 (correct), seq 1:518, ack 1, win 502, options [nop,nop,TS val 2747795780 ecr 1710266108], length 517
22:32:49.874878 IP (tos 0x0, ttl 240, id 342, offset 0, flags [none], proto TCP (6), length 60)
    13.225.43.44.443 > 192.168.0.6.36504: Flags [S.], cksum 0x5869 (correct), seq 295408455, ack 1452492527, win 65535, options [mss 1450,sackOK,TS val 1671369370 ecr 2747795738,nop,wscale 8], length 0
22:32:49.874913 IP (tos 0x0, ttl 64, id 60750, offset 0, flags [DF], proto TCP (6), length 52)
    192.168.0.6.36504 > 13.225.43.44.443: Flags [.], cksum 0x850c (correct), ack 1, win 502, options [nop,nop,TS val 2747795780 ecr 1671369370], length 0
22:32:49.875039 IP (tos 0x0, ttl 64, id 60751, offset 0, flags [DF], proto TCP (6), length 569)
    192.168.0.6.36504 > 13.225.43.44.443: Flags [P.], cksum 0x1205 (correct), seq 1:518, ack 1, win 502, options [nop,nop,TS val 2747795780 ecr 1671369370], length 517
22:32:49.908173 IP (tos 0x0, ttl 240, id 55884, offset 0, flags [none], proto TCP (6), length 52)
    13.225.43.44.443 > 192.168.0.6.36502: Flags [.], cksum 0xb572 (correct), ack 518, win 261, options [nop,nop,TS val 1176061114 ecr 2747795777], length 0
22:32:49.908644 IP (tos 0x0, ttl 240, id 42264, offset 0, flags [none], proto TCP (6), length 52)
    13.225.43.44.443 > 192.168.0.6.36506: Flags [.], cksum 0x5622 (correct), ack 518, win 261, options [nop,nop,TS val 1370553020 ecr 2747795778], length 0
22:32:49.909532 IP (tos 0x0, ttl 240, id 20289, offset 0, flags [none], proto TCP (6), length 52)
    13.225.43.44.443 > 192.168.0.6.36508: Flags [.], cksum 0x75a4 (correct), ack 518, win 261, options [nop,nop,TS val 1710266143 ecr 2747795780], length 0
22:32:49.909955 IP (tos 0x0, ttl 240, id 380, offset 0, flags [none], proto TCP (6), length 52)
    13.225.43.44.443 > 192.168.0.6.36504: Flags [.], cksum 0x83d5 (correct), ack 518, win 261, options [nop,nop,TS val 1671369405 ecr 2747795780], length 0
22:32:49.911417 IP (tos 0x0, ttl 240, id 42265, offset 0, flags [none], proto TCP (6), length 1490)
    13.225.43.44.443 > 192.168.0.6.36506: Flags [.], cksum 0x847c (correct), seq 1:1439, ack 518, win 261, options [nop,nop,TS val 1370553021 ecr 2747795778], length 1438
22:32:49.911426 IP (tos 0x0, ttl 64, id 1978, offset 0, flags [DF], proto TCP (6), length 52)
    192.168.0.6.36506 > 13.225.43.44.443: Flags [.], cksum 0x4f6d (correct), ack 1439, win 501, options [nop,nop,TS val 2747795816 ecr 1370553021], length 0
22:32:49.911780 IP (tos 0x0, ttl 240, id 42266, offset 0, flags [none], proto TCP (6), length 1490)
    13.225.43.44.443 > 192.168.0.6.36506: Flags [P.], cksum 0x52cc (correct), seq 1439:2877, ack 518, win 261, options [nop,nop,TS val 1370553021 ecr 2747795778], length 1438
22:32:49.911785 IP (tos 0x0, ttl 64, id 1979, offset 0, flags [DF], proto TCP (6), length 52)
    192.168.0.6.36506 > 13.225.43.44.443: Flags [.], cksum 0x49ce (correct), ack 2877, win 501, options [nop,nop,TS val 2747795817 ecr 1370553021], length 0
22:32:49.912056 IP (tos 0x0, ttl 240, id 42267, offset 0, flags [none], proto TCP (6), length 1490)
    13.225.43.44.443 > 192.168.0.6.36506: Flags [.], cksum 0xbf0a (correct), seq 2877:4315, ack 518, win 261, options [nop,nop,TS val 1370553021 ecr 2747795778], length 1438
22:32:49.912062 IP (tos 0x0, ttl 64, id 1980, offset 0, flags [DF], proto TCP (6), length 52)
    192.168.0.6.36506 > 13.225.43.44.443: Flags [.], cksum 0x4430 (correct), ack 4315, win 501, options [nop,nop,TS val 2747795817 ecr 1370553021], length 0
22:32:49.912343 IP (tos 0x0, ttl 240, id 55885, offset 0, flags [none], proto TCP (6), length 1490)
    13.225.43.44.443 > 192.168.0.6.36502: Flags [.], cksum 0x6990 (correct), seq 1:1439, ack 518, win 261, options [nop,nop,TS val 1176061115 ecr 2747795777], length 1438
22:32:49.912349 IP (tos 0x0, ttl 64, id 24943, offset 0, flags [DF], proto TCP (6), length 52)
    192.168.0.6.36502 > 13.225.43.44.443: Flags [.], cksum 0xaebb (correct), ack 1439, win 501, options [nop,nop,TS val 2747795817 ecr 1176061115], length 0
22:32:49.912752 IP (tos 0x0, ttl 240, id 55886, offset 0, flags [none], proto TCP (6), length 1490)
    13.225.43.44.443 > 192.168.0.6.36502: Flags [P.], cksum 0x15f8 (correct), seq 1439:2877, ack 518, win 261, options [nop,nop,TS val 1176061115 ecr 2747795777], length 1438
22:32:49.912759 IP (tos 0x0, ttl 64, id 24944, offset 0, flags [DF], proto TCP (6), length 52)
    192.168.0.6.36502 > 13.225.43.44.443: Flags [.], cksum 0xa91c (correct), ack 2877, win 501, options [nop,nop,TS val 2747795818 ecr 1176061115], length 0
22:32:49.912947 IP (tos 0x0, ttl 240, id 55887, offset 0, flags [none], proto TCP (6), length 1490)
    13.225.43.44.443 > 192.168.0.6.36502: Flags [.], cksum 0xd8a6 (correct), seq 2877:4315, ack 518, win 261, options [nop,nop,TS val 1176061115 ecr 2747795777], length 1438
22:32:49.912953 IP (tos 0x0, ttl 64, id 24945, offset 0, flags [DF], proto TCP (6), length 52)
    192.168.0.6.36502 > 13.225.43.44.443: Flags [.], cksum 0xa37e (correct), ack 4315, win 501, options [nop,nop,TS val 2747795818 ecr 1176061115], length 0
22:32:49.913148 IP (tos 0x0, ttl 240, id 20290, offset 0, flags [none], proto TCP (6), length 1490)
    13.225.43.44.443 > 192.168.0.6.36508: Flags [.], cksum 0xb9dc (correct), seq 1:1439, ack 518, win 261, options [nop,nop,TS val 1710266144 ecr 2747795780], length 1438
22:32:49.913152 IP (tos 0x0, ttl 64, id 53463, offset 0, flags [DF], proto TCP (6), length 52)
    192.168.0.6.36508 > 13.225.43.44.443: Flags [.], cksum 0x6eef (correct), ack 1439, win 501, options [nop,nop,TS val 2747795818 ecr 1710266144], length 0
22:32:49.913353 IP (tos 0x0, ttl 240, id 20291, offset 0, flags [none], proto TCP (6), length 1490)
    13.225.43.44.443 > 192.168.0.6.36508: Flags [P.], cksum 0x57b5 (correct), seq 1439:2877, ack 518, win 261, options [nop,nop,TS val 1710266144 ecr 2747795780], length 1438
22:32:49.913357 IP (tos 0x0, ttl 64, id 53464, offset 0, flags [DF], proto TCP (6), length 52)
    192.168.0.6.36508 > 13.225.43.44.443: Flags [.], cksum 0x6951 (correct), ack 2877, win 501, options [nop,nop,TS val 2747795818 ecr 1710266144], length 0
22:32:49.913561 IP (tos 0x0, ttl 240, id 20292, offset 0, flags [none], proto TCP (6), length 1490)
    13.225.43.44.443 > 192.168.0.6.36508: Flags [.], cksum 0x0d8d (correct), seq 2877:4315, ack 518, win 261, options [nop,nop,TS val 1710266144 ecr 2747795780], length 1438
22:32:49.913565 IP (tos 0x0, ttl 64, id 53465, offset 0, flags [DF], proto TCP (6), length 52)
    192.168.0.6.36508 > 13.225.43.44.443: Flags [.], cksum 0x63b3 (correct), ack 4315, win 501, options [nop,nop,TS val 2747795818 ecr 1710266144], length 0
22:32:49.915008 IP (tos 0x0, ttl 240, id 42268, offset 0, flags [none], proto TCP (6), length 585)
    13.225.43.44.443 > 192.168.0.6.36506: Flags [P.], cksum 0x3292 (correct), seq 4315:4848, ack 518, win 261, options [nop,nop,TS val 1370553023 ecr 2747795778], length 533
22:32:49.915015 IP (tos 0x0, ttl 64, id 1981, offset 0, flags [DF], proto TCP (6), length 52)
    192.168.0.6.36506 > 13.225.43.44.443: Flags [.], cksum 0x4216 (correct), ack 4848, win 501, options [nop,nop,TS val 2747795820 ecr 1370553023], length 0
22:32:49.915383 IP (tos 0x0, ttl 240, id 55888, offset 0, flags [none], proto TCP (6), length 585)
    13.225.43.44.443 > 192.168.0.6.36502: Flags [P.], cksum 0xe2f6 (correct), seq 4315:4848, ack 518, win 261, options [nop,nop,TS val 1176061118 ecr 2747795777], length 533
